id,fullName,shortName,category,sizing
IT218,"Bag of mixed hydraulic lime, 15kg, partially used bag sealed",Hydraulic Lime Mix Bag,Non-professional Construction Material,Small
IT219,"Salvaged fired clay airbrick, standard 225x112x75mm, intact voids",Salvaged Clay Airbrick,Non-professional Construction Material,Small
IT220,"Length of steel square hollow section tube, 50x50x3mm, 2m",Steel Square Hollow Section,Non-professional Construction Material,Large
IT221,"Stack of salvaged concrete roof tiles, flat type, 10 units",Salvaged Flat Concrete Roof Tiles,Non-professional Construction Material,Small
IT222,"Partial bag of premixed ready-mix concrete, 20kg, hardened lumps removed",Ready-Mix Concrete Bag,Non-professional Construction Material,Small
IT223,"Bundle of used galvanized mild steel wire, 2mm gauge, coiled 5m",Galvanized Steel Wire Bundle,Non-professional Construction Material,Small
IT224,"Salvaged pressed metal ceiling panel, 600x600mm embossed pattern",Salvaged Metal Ceiling Panel,Non-professional Construction Material,Small
IT225,"Used zinc-coated steel downpipe section, 75mm, 1.5m length",Zinc Steel Downpipe Section,Non-professional Construction Material,Large
IT226,"Bag of perlite aggregate insulation material, 10L bag, loose fill",Perlite Aggregate Bag,Non-professional Construction Material,Small
IT227,"Salvaged concrete drainage channel section, U-type 300x150x500mm",Salvaged Concrete Drainage Section,Non-professional Construction Material,Small
IT228,"Length of recycled steel road form shuttering, 2m, perforated",Recycled Steel Shuttering Strip,Non-professional Construction Material,Large
IT229,"Used rubble stone pieces from demolished wall, limestone type, 10kg",Limestone Rubble Pieces,Non-professional Construction Material,Small
IT230,"Salvaged translucent polycarbonate roofing sheet, 1.8m, cracked",Salvaged Polycarbonate Roofing Sheet,Non-professional Construction Material,Large
IT231,"Length of used copper plumbing pipe, 15mm, 1m section, bent",Used Copper Plumbing Pipe,Non-professional Construction Material,Small
IT232,"Bag of fine graded river sand for concrete mixing, 20kg",River Sand for Concrete Bag,Non-professional Construction Material,Small
IT233,"Salvaged steel angle lintel, 75x50x6mm, 1.2m length",Steel Angle Lintel,Non-professional Construction Material,Large
IT234,"Pile of used concrete roof insulation perlite slabs, 3 units",Concrete Insulation Slab Pile,Non-professional Construction Material,Large
IT235,"Salvaged glazed terracotta coping tile, 300mm length, blue glaze",Glazed Terracotta Coping Tile,Non-professional Construction Material,Small
IT236,"Used PVC rainwater gutter section, 110mm, 2m length, clip on",Used PVC Rainwater Gutter,Non-professional Construction Material,Large
IT237,"Bundle of jute rope, 12mm diameter, 10m length, construction grade",Construction Jute Rope Bundle,Non-professional Construction Material,Large
IT238,"Salvaged fired clay floor quarry tile, 150x150mm, unglazed red",Salvaged Clay Quarry Tile,Non-professional Construction Material,Small
IT239,"Stack of used hollow concrete interlocking paving blocks, 6 units",Interlocking Concrete Paving Blocks,Non-professional Construction Material,Small
IT240,"Bag of ground granulated blast furnace slag for concrete mix, 10kg",GGBS Concrete Mix Bag,Non-professional Construction Material,Small
IT241,"Salvaged aluminum flat sheet, 600x1200x2mm, surface oxidized",Salvaged Aluminum Flat Sheet,Non-professional Construction Material,Large
IT242,Front outboard motor cowling shell from old Yamaha 40HP engine,Outboard Motor Cowling Shell,Scrap Parts,Small
IT243,"Single wooden chair leg with mortise joint, turned style, hardwood",Turned Wooden Chair Leg,Scrap Parts,Small
IT244,"Tabletop from broken Thai restaurant folding table, formica laminate",Formica Laminate Tabletop,Scrap Parts,Large
IT245,"Bow section of fiberglass longtail canal boat, cracked hull",Fiberglass Boat Bow Section,Scrap Parts,Large
IT246,"Washing machine drum, stainless steel perforated barrel, no motor",Washing Machine Drum,Scrap Parts,Small
IT247,"Single car door, white, from Toyota Corolla sedan, dented",Toyota Corolla Car Door,Scrap Parts,Large
IT248,"Motorcycle fuel tank from Honda Wave 110, dented, chrome cap",Honda Wave Fuel Tank,Scrap Parts,Small
IT249,"Gas stove cast iron burner grate set, two burners, complete",Gas Stove Burner Grate Set,Scrap Parts,Small
IT250,Push cart wheel axle assembly with two solid rubber wheels,Cart Wheel Axle Assembly,Scrap Parts,Small
IT251,"Drawer unit from old wooden wardrobe, two drawers with handles",Wardrobe Drawer Unit,Scrap Parts,Small
IT252,"Used tuk-tuk rear seat bench cushion with vinyl cover, cracked",Tuk-Tuk Rear Seat Cushion,Scrap Parts,Large
IT253,"Single wooden staircase step section, hardwood, paint stripped",Wooden Staircase Step Section,Scrap Parts,Large
IT254,Outboard motor propeller shaft assembly from old Suzuki engine,Outboard Motor Propeller Shaft,Scrap Parts,Small
IT255,"Refrigerator compressor unit, small, from broken household fridge",Fridge Compressor Unit,Scrap Parts,Small
IT256,"Bicycle rear wheel with gear cassette, 26-inch, spokes intact",Bicycle Rear Wheel with Cassette,Scrap Parts,Small
IT257,"Wooden cabinet door pair with ornate carved panel, teak wood",Carved Teak Cabinet Door Pair,Scrap Parts,Small
IT258,"Boat rudder assembly from small canal wooden boat, tiller attached",Canal Boat Rudder with Tiller,Scrap Parts,Small
IT259,"Metal desk drawer unit with three drawers, ball-bearing slides",Metal Desk Drawer Unit,Scrap Parts,Small
IT260,"Electric motor housing from old water pump, 0.5HP, casing only",Water Pump Motor Housing,Scrap Parts,Small
IT261,"Single rattan armchair arm section, curved, with upholstery tack",Rattan Chair Arm Section,Scrap Parts,Small
IT262,"Motorcycle wheel rim from Honda PCX 150, alloy, no tire",Honda PCX Alloy Wheel Rim,Scrap Parts,Small
IT263,Wooden boat transom section with outboard motor mounting bracket,Boat Transom with Motor Bracket,Scrap Parts,Large
IT264,Old sewing machine arm and needle housing from Singer model,Sewing Machine Arm Housing,Scrap Parts,Small
IT265,"Industrial fan blade unit, aluminum, five blades, hub intact",Industrial Fan Blade Unit,Scrap Parts,Small
IT266,"Single school chair seat and back panel, molded plastic, orange",School Chair Seat and Back,Scrap Parts,Small
IT267,"Front fork assembly from adult bicycle, threaded, no handlebars",Bicycle Front Fork Assembly,Scrap Parts,Small
IT268,"Old Thai longtail boat steering wheel, wooden, with iron spoke",Longtail Boat Steering Wheel,Scrap Parts,Small
IT269,"Drawer chest top surface section, plywood with veneer, handles on",Drawer Chest Top Panel,Scrap Parts,Large
IT270,"Electric ceiling fan canopy and motor housing, teak wood cover",Ceiling Fan Motor Housing,Scrap Parts,Small
IT271,"Car bonnet from Isuzu pickup truck, grey primer, one dent",Isuzu Pickup Truck Bonnet,Scrap Parts,Large
IT272,"Wooden table base with four legs, round pedestal type, no top",Round Pedestal Table Base,Scrap Parts,Small
IT273,"Outboard motor lower unit from Mariner 15HP, gearbox intact",Outboard Motor Lower Gearbox Unit,Scrap Parts,Small
IT274,"Single bed headboard, rattan weave with wooden frame, intact",Rattan Bed Headboard,Scrap Parts,Large
IT275,Water pump impeller housing from old submersible pump unit,Submersible Pump Impeller Housing,Scrap Parts,Small
IT276,"Motorcycle swingarm from Yamaha Fino scooter, chrome, no wheel",Yamaha Fino Swingarm,Scrap Parts,Small
IT277,"Broken piano keyboard section, 30 keys, ivory-look keytops",Piano Keyboard Section,Scrap Parts,Large
IT278,"Wooden door panel with glass louvres, four slats, teak frame",Wooden Door with Glass Louvres,Scrap Parts,Large
IT279,"Air conditioning compressor unit from split-type system, old",AC Split-Type Compressor Unit,Scrap Parts,Small
IT280,Motorcycle exhaust pipe and silencer from old Honda Dream,Honda Dream Exhaust Silencer,Scrap Parts,Large
IT281,"Wooden wardrobe hanging rail section with brackets, full width",Wardrobe Hanging Rail with Brackets,Scrap Parts,Large
IT282,"Food cart wheel and axle frame assembly, stainless steel type",Food Cart Wheel Frame Assembly,Scrap Parts,Small
IT283,"Single sofa backrest cushion unit, foam filled, fabric cover",Sofa Backrest Cushion,Scrap Parts,Small
IT284,"Old longtail boat hull rib section, hardwood, curved, 1.5m arc",Longtail Boat Hull Rib Section,Scrap Parts,Large
IT285,"Ceiling fan blade set, four wooden blades with mounting irons",Ceiling Fan Blade Set,Scrap Parts,Small
IT286,"Rotary clothes washing mangle wringer unit, double rollers intact",Clothes Mangle Wringer Unit,Scrap Parts,Small
IT287,"Metal shelf bracket set of six, heavy duty, painted black",Heavy Duty Metal Shelf Bracket Set,Scrap Parts,Small
IT288,"Old wooden boat deck hatch with hinges and clasp, teak",Teak Boat Deck Hatch,Scrap Parts,Small
IT289,"Motorcycle carburetor from Kawasaki Ninja 150, cleaned",Kawasaki Ninja Carburetor,Scrap Parts,Small
IT290,"Single drawer from Thai wooden kitchen cabinet, teak, dovetail joints",Teak Kitchen Cabinet Drawer,Scrap Parts,Small
IT291,"Ferris wheel seat gondola from children's amusement ride, fiberglass",Amusement Ride Gondola Seat,Scrap Parts,Small
IT292,"Small outboard engine throttle and gearshift control box, used",Outboard Engine Control Box,Scrap Parts,Small
IT293,"Old food vending cart canopy frame, folding aluminum poles, faded",Food Cart Canopy Frame,Scrap Parts,Large
IT294,"Wooden daybed side panel section, carved motif, lacquered finish",Carved Daybed Side Panel,Scrap Parts,Large
IT295,"Bus seat unit with metal frame and vinyl upholstery, two-person",Bus Seat Unit Two-Person,Scrap Parts,Large
IT296,"Bicycle frame from old Raleigh Roadster, no wheels, chrome lugs",Raleigh Roadster Bicycle Frame,Scrap Parts,Large
IT297,"Air compressor tank cylinder only, 20-liter, rusted exterior",Air Compressor Tank Cylinder,Scrap Parts,Small
IT298,"Wooden shop display shelf section, glass front panel missing",Shop Display Shelf Section,Scrap Parts,Large
IT299,"Used hand water pump head assembly, cast iron, no pipe attached",Cast Iron Hand Pump Head,Scrap Parts,Small
IT300,"Old canal barge fender, hardwood block with rope loop, 40cm",Canal Barge Fender Block,Scrap Parts,Small
IT301,"Commercial food blender base unit with motor, no jar, stainless",Commercial Blender Base Unit,Scrap Parts,Small
